{
  "id": "11111111-1111-4111-8111-111111111111",
  "runId": "perf-20260902-120000-a1b2c3d4",
  "kind": "raw",
  "uri": "s3://perfeng-example/runs/perf-20260902-120000-a1b2c3d4/raw/k6-summary.json",
  "sha256": "765e697a5a9036636e44dcd1caed0dd176f58b7e621f2c747e99e779f8400fe1",
  "sizeBytes": 172,
  "mediaType": "application/json",
  "format": "k6-summary-json"
}
